{
  "document": {
    "document_id": "XEX-NDC3",
    "country": "XEX",
    "kind": "NDC",
    "title": "Exampleland NDC 3.0 (SYNTHETIC EXAMPLE, not a real country)",
    "edition_date": "2025-11-01",
    "language": "en",
    "page_count": 40,
    "sha256": null
  },
  "versions": {
    "taxonomy": "0.1.0-draft",
    "vocabulary": "0.2.0-draft",
    "prompt": "extract-0.1",
    "model": null
  },
  "coverage": {
    "pages": [
      {
        "page": 1,
        "disposition": "background",
        "record_ids": [],
        "reason": "Cover and foreword"
      },
      {
        "page": 8,
        "disposition": "extracted",
        "record_ids": [
          "XEX-NDC3-p8-1"
        ],
        "reason": null
      },
      {
        "page": 12,
        "disposition": "extracted",
        "record_ids": [
          "XEX-NDC3-p12-1"
        ],
        "reason": null
      },
      {
        "page": 21,
        "disposition": "extracted",
        "record_ids": [
          "XEX-NDC3-p21-1",
          "XEX-NDC3-p21-2",
          "XEX-NDC3-p21-3"
        ],
        "reason": null
      },
      {
        "page": 22,
        "disposition": "unreadable",
        "record_ids": [],
        "reason": "Scanned table, OCR failed"
      },
      {
        "page": 30,
        "disposition": "extracted",
        "record_ids": [
          "XEX-NDC3-p30-1",
          "XEX-NDC3-p30-2"
        ],
        "reason": null
      }
    ],
    "limitations": [
      "Pages 2-7, 9-11, 13-20, 23-29 and 31-40 were not in the selected sample."
    ]
  },
  "records": [
    {
      "record_id": "XEX-NDC3-p8-1",
      "statement_type": "context",
      "statement_en": "Spring floods in 2024 displaced about 12,000 people in the Northern basin and caused estimated losses of USD 90 million.",
      "reference_period": "2024",
      "evidence": [
        {
          "evidence_id": "E1",
          "page": 8,
          "printed_page": "6",
          "quote_original": "spring floods in 2024 displaced about 12,000 people in the Northern basin, with estimated losses of USD 90 million",
          "quote_en": null,
          "table_context": null
        }
      ],
      "labels": {
        "topic_ids": [
          "DRM-02",
          "WAT-03"
        ],
        "purpose": [],
        "hazard": [
          "flood"
        ],
        "risk_component": [
          "impact",
          "exposure"
        ],
        "risk_function": [],
        "affected_group": [],
        "cross_cutting_theme": [],
        "policy_instrument": [],
        "geographic_scope": "subnational"
      },
      "places": [
        {
          "source_name": "Northern basin",
          "place_type": "basin"
        }
      ],
      "stakeholders": [],
      "facts": [
        {
          "fact_id": "F1",
          "fact_type": "observation",
          "metric": "people displaced by 2024 spring floods",
          "value_as_stated": "about 12,000",
          "value": "12000",
          "lower": null,
          "upper": null,
          "unit": "people",
          "currency": null,
          "comparator": "approximate",
          "direction": null,
          "basis": null,
          "total_or_additional": null,
          "baseline": null,
          "period_role": "observation",
          "period": "2024",
          "scenario": null,
          "scope": "Northern basin",
          "conditionality": null,
          "condition_text": null,
          "target_kind": null,
          "finance_source_type": null,
          "finance_status": null,
          "finance_source": null,
          "evidence_id": "E1"
        },
        {
          "fact_id": "F2",
          "fact_type": "observation",
          "metric": "estimated losses from 2024 spring floods",
          "value_as_stated": "USD 90 million",
          "value": "90000000",
          "lower": null,
          "upper": null,
          "unit": null,
          "currency": "USD",
          "comparator": "approximate",
          "direction": null,
          "basis": null,
          "total_or_additional": null,
          "baseline": null,
          "period_role": "observation",
          "period": "2024",
          "scenario": null,
          "scope": "Northern basin",
          "conditionality": null,
          "condition_text": null,
          "target_kind": null,
          "finance_source_type": null,
          "finance_status": null,
          "finance_source": null,
          "evidence_id": "E1"
        }
      ],
      "details": [],
      "missing_fields": [],
      "unmapped_concepts": [],
      "notes": "Observed hazard impact is context, not a result of policy."
    },
    {
      "record_id": "XEX-NDC3-p12-1",
      "statement_type": "commitment",
      "statement_en": "Exampleland will reduce greenhouse-gas emissions by 15% below 1990 by 2035 unconditionally, and by 25% subject to international support.",
      "reference_period": null,
      "evidence": [
        {
          "evidence_id": "E2",
          "page": 12,
          "printed_page": "10",
          "quote_original": "reduce GHG emissions by 15% below 1990 levels by 2035 unconditionally, and by up to 25% subject to international support",
          "quote_en": null,
          "table_context": null
        }
      ],
      "labels": {
        "topic_ids": [
          "CLM-06"
        ],
        "purpose": [
          "mitigation"
        ],
        "hazard": [],
        "risk_component": [],
        "risk_function": [],
        "affected_group": [],
        "cross_cutting_theme": [],
        "policy_instrument": [],
        "geographic_scope": "national"
      },
      "places": [],
      "stakeholders": [],
      "facts": [
        {
          "fact_id": "F1",
          "fact_type": "target",
          "metric": "economy-wide GHG emissions",
          "value_as_stated": "15%",
          "value": "15",
          "lower": null,
          "upper": null,
          "unit": "%",
          "currency": null,
          "comparator": "at_least",
          "direction": "decrease",
          "basis": "historical_reduction",
          "total_or_additional": "total",
          "baseline": {
            "value": null,
            "unit": null,
            "period": "1990"
          },
          "period_role": "target",
          "period": "2035",
          "scenario": null,
          "scope": "economy-wide",
          "conditionality": "unconditional",
          "condition_text": null,
          "target_kind": "quantitative",
          "finance_source_type": null,
          "finance_status": null,
          "finance_source": null,
          "evidence_id": "E2"
        },
        {
          "fact_id": "F2",
          "fact_type": "target",
          "metric": "economy-wide GHG emissions",
          "value_as_stated": "up to 25%",
          "value": "25",
          "lower": null,
          "upper": null,
          "unit": "%",
          "currency": null,
          "comparator": "at_most",
          "direction": "decrease",
          "basis": "historical_reduction",
          "total_or_additional": "total",
          "baseline": {
            "value": null,
            "unit": null,
            "period": "1990"
          },
          "period_role": "target",
          "period": "2035",
          "scenario": null,
          "scope": "economy-wide",
          "conditionality": "conditional",
          "condition_text": "subject to international support",
          "target_kind": "quantitative",
          "finance_source_type": null,
          "finance_status": null,
          "finance_source": null,
          "evidence_id": "E2"
        }
      ],
      "details": [],
      "missing_fields": [
        {
          "field": "facts/F1/baseline/value",
          "reason": "not_stated",
          "detail": "1990 emissions level is not given on this page"
        }
      ],
      "unmapped_concepts": [],
      "notes": "Two target variants: never averaged, never summed."
    },
    {
      "record_id": "XEX-NDC3-p21-1",
      "statement_type": "planned_action",
      "statement_en": "The Ministry of Emergency Situations will install 40 automatic river gauges with SMS flood warnings in the Northern basin by 2028.",
      "reference_period": null,
      "evidence": [
        {
          "evidence_id": "E3",
          "page": 21,
          "printed_page": "19",
          "quote_original": "install 40 automatic river-level gauges linked to SMS flood warnings in the Northern basin by 2028",
          "quote_en": null,
          "table_context": "Table 5: Adaptation measures, column 'Responsible body': Ministry of Emergency Situations"
        }
      ],
      "labels": {
        "topic_ids": [
          "DRM-03"
        ],
        "purpose": [
          "adaptation",
          "disaster_risk_reduction"
        ],
        "hazard": [
          "flood"
        ],
        "risk_component": [],
        "risk_function": [
          "early_warning_preparedness"
        ],
        "affected_group": [],
        "cross_cutting_theme": [],
        "policy_instrument": [
          "information_warning",
          "infrastructure_service"
        ],
        "geographic_scope": "subnational"
      },
      "places": [
        {
          "source_name": "Northern basin",
          "place_type": "basin"
        }
      ],
      "stakeholders": [
        {
          "name_original": "Ministry of Emergency Situations",
          "name_en": "Ministry of Emergency Situations",
          "role": "responsible",
          "evidence_id": "E3"
        }
      ],
      "facts": [
        {
          "fact_id": "F1",
          "fact_type": "target",
          "metric": "automatic river gauges installed",
          "value_as_stated": "40",
          "value": "40",
          "lower": null,
          "upper": null,
          "unit": "gauges",
          "currency": null,
          "comparator": "equal",
          "direction": "increase",
          "basis": "absolute",
          "total_or_additional": "not_stated",